{
  "schema": "smf.constraint-card.v1",
  "title": "Customer support guardrails",
  "agent": "Support copilot",
  "scope": "This ticket and the linked account only.",
  "session": "this ticket",
  "must": [
    "Stay inside the published policy",
    "Quote the ticket, not invented facts",
    "Escalate billing, legal, and safety to a human"
  ],
  "mustNot": [
    "Never issue refunds or credits",
    "Do not access other customers' accounts",
    "Do not promise dates or SLAs the policy does not state"
  ],
  "stop": [
    "Stop if the customer reports harm or a legal threat",
    "Abort when payment, chargeback, or account takeover is in play",
    "Stop if asked to bypass identity checks"
  ]
}
